No.     Time           Source                Destination           Protocol Length Info
      1 0.000000000    PCSSystemtec_ad:25:87 Broadcast             ARP      42     Who has 192.168.50.101? Tell 192.168.50.100

Frame 1: 42 bytes on wire (336 bits), 42 bytes captured (336 bits) on interface eth0, id 0
Ethernet II, Src: PCSSystemtec_ad:25:87 (08:00:27:ad:25:87), Dst: Broadcast (ff:ff:ff:ff:ff:ff)
Address Resolution Protocol (request)

No.     Time           Source                Destination           Protocol Length Info
      2 0.000849934    PCSSystemtec_5c:bf:f2 PCSSystemtec_ad:25:87 ARP      60     192.168.50.101 is at 08:00:27:5c:bf:f2

Frame 2: 60 bytes on wire (480 bits), 60 bytes captured (480 bits) on interface eth0, id 0
Ethernet II, Src: PCSSystemtec_5c:bf:f2 (08:00:27:5c:bf:f2), Dst: PCSSystemtec_ad:25:87 (08:00:27:ad:25:87)
Address Resolution Protocol (reply)

No.     Time           Source                Destination           Protocol Length Info
      3 0.112475517    192.168.50.100        192.168.50.101        IPv4     42     Fragmented IP protocol (proto=TCP 6, off=0, ID=420e) [Reassembled in #5]

Frame 3: 42 bytes on wire (336 bits), 42 bytes captured (336 bits) on interface eth0, id 0
Ethernet II, Src: PCSSystemtec_ad:25:87 (08:00:27:ad:25:87), Dst: PCSSystemtec_5c:bf:f2 (08:00:27:5c:bf:f2)
Internet Protocol Version 4, Src: 192.168.50.100, Dst: 192.168.50.101
Data (8 bytes)

0000  e9 a5 0d 3d 88 25 de 3e                           ...=.%.>

No.     Time           Source                Destination           Protocol Length Info
      4 0.112623884    192.168.50.100        192.168.50.101        IPv4     42     Fragmented IP protocol (proto=TCP 6, off=8, ID=420e) [Reassembled in #5]

Frame 4: 42 bytes on wire (336 bits), 42 bytes captured (336 bits) on interface eth0, id 0
Ethernet II, Src: PCSSystemtec_ad:25:87 (08:00:27:ad:25:87), Dst: PCSSystemtec_5c:bf:f2 (08:00:27:5c:bf:f2)
Internet Protocol Version 4, Src: 192.168.50.100, Dst: 192.168.50.101
Data (8 bytes)

0000  00 00 00 00 60 02 04 00                           ....`...

No.     Time           Source                Destination           Protocol Length Info
      5 0.112717404    192.168.50.100        192.168.50.101        TCP      42     59813 → 3389 [SYN] Seq=0 Win=1024 Len=0 MSS=1460

Frame 5: 42 bytes on wire (336 bits), 42 bytes captured (336 bits) on interface eth0, id 0
Ethernet II, Src: PCSSystemtec_ad:25:87 (08:00:27:ad:25:87), Dst: PCSSystemtec_5c:bf:f2 (08:00:27:5c:bf:f2)
Internet Protocol Version 4, Src: 192.168.50.100, Dst: 192.168.50.101
Transmission Control Protocol, Src Port: 59813, Dst Port: 3389, Seq: 0, Len: 0

No.     Time           Source                Destination           Protocol Length Info
      6 0.113055592    192.168.50.100        192.168.50.101        IPv4     42     Fragmented IP protocol (proto=TCP 6, off=0, ID=c2c4) [Reassembled in #8]

Frame 6: 42 bytes on wire (336 bits), 42 bytes captured (336 bits) on interface eth0, id 0
Ethernet II, Src: PCSSystemtec_ad:25:87 (08:00:27:ad:25:87), Dst: PCSSystemtec_5c:bf:f2 (08:00:27:5c:bf:f2)
Internet Protocol Version 4, Src: 192.168.50.100, Dst: 192.168.50.101
Data (8 bytes)

0000  e9 a5 01 00 88 25 de 3e                           .....%.>

No.     Time           Source                Destination           Protocol Length Info
      7 0.113146326    192.168.50.100        192.168.50.101        IPv4     42     Fragmented IP protocol (proto=TCP 6, off=8, ID=c2c4) [Reassembled in #8]

Frame 7: 42 bytes on wire (336 bits), 42 bytes captured (336 bits) on interface eth0, id 0
Ethernet II, Src: PCSSystemtec_ad:25:87 (08:00:27:ad:25:87), Dst: PCSSystemtec_5c:bf:f2 (08:00:27:5c:bf:f2)
Internet Protocol Version 4, Src: 192.168.50.100, Dst: 192.168.50.101
Data (8 bytes)

0000  00 00 00 00 60 02 04 00                           ....`...

No.     Time           Source                Destination           Protocol Length Info
      8 0.113261580    192.168.50.100        192.168.50.101        TCP      42     59813 → 256 [SYN] Seq=0 Win=1024 Len=0 MSS=1460

Frame 8: 42 bytes on wire (336 bits), 42 bytes captured (336 bits) on interface eth0, id 0
Ethernet II, Src: PCSSystemtec_ad:25:87 (08:00:27:ad:25:87), Dst: PCSSystemtec_5c:bf:f2 (08:00:27:5c:bf:f2)
Internet Protocol Version 4, Src: 192.168.50.100, Dst: 192.168.50.101
Transmission Control Protocol, Src Port: 59813, Dst Port: 256, Seq: 0, Len: 0

No.     Time           Source                Destination           Protocol Length Info
      9 0.113483009    192.168.50.100        192.168.50.101        IPv4     42     Fragmented IP protocol (proto=TCP 6, off=0, ID=8647) [Reassembled in #12]

Frame 9: 42 bytes on wire (336 bits), 42 bytes captured (336 bits) on interface eth0, id 0
Ethernet II, Src: PCSSystemtec_ad:25:87 (08:00:27:ad:25:87), Dst: PCSSystemtec_5c:bf:f2 (08:00:27:5c:bf:f2)
Internet Protocol Version 4, Src: 192.168.50.100, Dst: 192.168.50.101
Data (8 bytes)

0000  e9 a5 04 01 88 25 de 3e                           .....%.>

No.     Time           Source                Destination           Protocol Length Info
     10 0.113601903    192.168.50.100        192.168.50.101        IPv4     42     Fragmented IP protocol (proto=TCP 6, off=8, ID=8647) [Reassembled in #12]

Frame 10: 42 bytes on wire (336 bits), 42 bytes captured (336 bits) on interface eth0, id 0
Ethernet II, Src: PCSSystemtec_ad:25:87 (08:00:27:ad:25:87), Dst: PCSSystemtec_5c:bf:f2 (08:00:27:5c:bf:f2)
Internet Protocol Version 4, Src: 192.168.50.100, Dst: 192.168.50.101
Data (8 bytes)

0000  00 00 00 00 60 02 04 00                           ....`...

No.     Time           Source                Destination           Protocol Length Info
     11 0.113669804    192.168.50.101        192.168.50.100        TCP      60     3389 → 59813 [RST, ACK] Seq=1 Ack=1 Win=0 Len=0

Frame 11: 60 bytes on wire (480 bits), 60 bytes captured (480 bits) on interface eth0, id 0
Ethernet II, Src: PCSSystemtec_5c:bf:f2 (08:00:27:5c:bf:f2), Dst: PCSSystemtec_ad:25:87 (08:00:27:ad:25:87)
Internet Protocol Version 4, Src: 192.168.50.101, Dst: 192.168.50.100
Transmission Control Protocol, Src Port: 3389, Dst Port: 59813, Seq: 1, Ack: 1, Len: 0

No.     Time           Source                Destination           Protocol Length Info
     12 0.113685828    192.168.50.100        192.168.50.101        TCP      42     59813 → 1025 [SYN] Seq=0 Win=1024 Len=0 MSS=1460

Frame 12: 42 bytes on wire (336 bits), 42 bytes captured (336 bits) on interface eth0, id 0
Ethernet II, Src: PCSSystemtec_ad:25:87 (08:00:27:ad:25:87), Dst: PCSSystemtec_5c:bf:f2 (08:00:27:5c:bf:f2)
Internet Protocol Version 4, Src: 192.168.50.100, Dst: 192.168.50.101
Transmission Control Protocol, Src Port: 59813, Dst Port: 1025, Seq: 0, Len: 0

No.     Time           Source                Destination           Protocol Length Info
     13 0.113910153    192.168.50.100        192.168.50.101        IPv4     42     Fragmented IP protocol (proto=TCP 6, off=0, ID=9443) [Reassembled in #16]

Frame 13: 42 bytes on wire (336 bits), 42 bytes captured (336 bits) on interface eth0, id 0
Ethernet II, Src: PCSSystemtec_ad:25:87 (08:00:27:ad:25:87), Dst: PCSSystemtec_5c:bf:f2 (08:00:27:5c:bf:f2)
Internet Protocol Version 4, Src: 192.168.50.100, Dst: 192.168.50.101
Data (8 bytes)

0000  e9 a5 00 19 88 25 de 3e                           .....%.>

No.     Time           Source                Destination           Protocol Length Info
     14 0.114017217    192.168.50.100        192.168.50.101        IPv4     42     Fragmented IP protocol (proto=TCP 6, off=8, ID=9443) [Reassembled in #16]

Frame 14: 42 bytes on wire (336 bits), 42 bytes captured (336 bits) on interface eth0, id 0
Ethernet II, Src: PCSSystemtec_ad:25:87 (08:00:27:ad:25:87), Dst: PCSSystemtec_5c:bf:f2 (08:00:27:5c:bf:f2)
Internet Protocol Version 4, Src: 192.168.50.100, Dst: 192.168.50.101
Data (8 bytes)

0000  00 00 00 00 60 02 04 00                           ....`...

No.     Time           Source                Destination           Protocol Length Info
     15 0.114167005    192.168.50.101        192.168.50.100        TCP      60     256 → 59813 [RST, ACK] Seq=1 Ack=1 Win=0 Len=0

Frame 15: 60 bytes on wire (480 bits), 60 bytes captured (480 bits) on interface eth0, id 0
Ethernet II, Src: PCSSystemtec_5c:bf:f2 (08:00:27:5c:bf:f2), Dst: PCSSystemtec_ad:25:87 (08:00:27:ad:25:87)
Internet Protocol Version 4, Src: 192.168.50.101, Dst: 192.168.50.100
Transmission Control Protocol, Src Port: 256, Dst Port: 59813, Seq: 1, Ack: 1, Len: 0

No.     Time           Source                Destination           Protocol Length Info
     16 0.114146518    192.168.50.100        192.168.50.101        TCP      42     59813 → 25 [SYN] Seq=0 Win=1024 Len=0 MSS=1460

Frame 16: 42 bytes on wire (336 bits), 42 bytes captured (336 bits) on interface eth0, id 0
Ethernet II, Src: PCSSystemtec_ad:25:87 (08:00:27:ad:25:87), Dst: PCSSystemtec_5c:bf:f2 (08:00:27:5c:bf:f2)
Internet Protocol Version 4, Src: 192.168.50.100, Dst: 192.168.50.101
Transmission Control Protocol, Src Port: 59813, Dst Port: 25, Seq: 0, Len: 0

No.     Time           Source                Destination           Protocol Length Info
     17 0.114327162    192.168.50.100        192.168.50.101        IPv4     42     Fragmented IP protocol (proto=TCP 6, off=0, ID=074c) [Reassembled in #19]

Frame 17: 42 bytes on wire (336 bits), 42 bytes captured (336 bits) on interface eth0, id 0
Ethernet II, Src: PCSSystemtec_ad:25:87 (08:00:27:ad:25:87), Dst: PCSSystemtec_5c:bf:f2 (08:00:27:5c:bf:f2)
Internet Protocol Version 4, Src: 192.168.50.100, Dst: 192.168.50.101
Data (8 bytes)

0000  e9 a5 00 c7 88 25 de 3e                           .....%.>

No.     Time           Source                Destination           Protocol Length Info
     18 0.114416199    192.168.50.100        192.168.50.101        IPv4     42     Fragmented IP protocol (proto=TCP 6, off=8, ID=074c) [Reassembled in #19]

Frame 18: 42 bytes on wire (336 bits), 42 bytes captured (336 bits) on interface eth0, id 0
Ethernet II, Src: PCSSystemtec_ad:25:87 (08:00:27:ad:25:87), Dst: PCSSystemtec_5c:bf:f2 (08:00:27:5c:bf:f2)
Internet Protocol Version 4, Src: 192.168.50.100, Dst: 192.168.50.101
Data (8 bytes)

0000  00 00 00 00 60 02 04 00                           ....`...

No.     Time           Source                Destination           Protocol Length Info
     19 0.114497584    192.168.50.100        192.168.50.101        TCP      42     59813 → 199 [SYN] Seq=0 Win=1024 Len=0 MSS=1460

Frame 19: 42 bytes on wire (336 bits), 42 bytes captured (336 bits) on interface eth0, id 0
Ethernet II, Src: PCSSystemtec_ad:25:87 (08:00:27:ad:25:87), Dst: PCSSystemtec_5c:bf:f2 (08:00:27:5c:bf:f2)
Internet Protocol Version 4, Src: 192.168.50.100, Dst: 192.168.50.101
Transmission Control Protocol, Src Port: 59813, Dst Port: 199, Seq: 0, Len: 0

No.     Time           Source                Destination           Protocol Length Info
     20 0.114536064    192.168.50.101        192.168.50.100        TCP      60     1025 → 59813 [RST, ACK] Seq=1 Ack=1 Win=0 Len=0

Frame 20: 60 bytes on wire (480 bits), 60 bytes captured (480 bits) on interface eth0, id 0
Ethernet II, Src: PCSSystemtec_5c:bf:f2 (08:00:27:5c:bf:f2), Dst: PCSSystemtec_ad:25:87 (08:00:27:ad:25:87)
Internet Protocol Version 4, Src: 192.168.50.101, Dst: 192.168.50.100
Transmission Control Protocol, Src Port: 1025, Dst Port: 59813, Seq: 1, Ack: 1, Len: 0

No.     Time           Source                Destination           Protocol Length Info
     21 0.114536256    192.168.50.101        192.168.50.100        TCP      60     25 → 59813 [SYN, ACK] Seq=0 Ack=1 Win=5840 Len=0 MSS=1460

Frame 21: 60 bytes on wire (480 bits), 60 bytes captured (480 bits) on interface eth0, id 0
Ethernet II, Src: PCSSystemtec_5c:bf:f2 (08:00:27:5c:bf:f2), Dst: PCSSystemtec_ad:25:87 (08:00:27:ad:25:87)
Internet Protocol Version 4, Src: 192.168.50.101, Dst: 192.168.50.100
Transmission Control Protocol, Src Port: 25, Dst Port: 59813, Seq: 0, Ack: 1, Len: 0

No.     Time           Source                Destination           Protocol Length Info
     22 0.114582776    192.168.50.100        192.168.50.101        TCP      54     59813 → 25 [RST] Seq=1 Win=0 Len=0

Frame 22: 54 bytes on wire (432 bits), 54 bytes captured (432 bits) on interface eth0, id 0
Ethernet II, Src: PCSSystemtec_ad:25:87 (08:00:27:ad:25:87), Dst: PCSSystemtec_5c:bf:f2 (08:00:27:5c:bf:f2)
Internet Protocol Version 4, Src: 192.168.50.100, Dst: 192.168.50.101
Transmission Control Protocol, Src Port: 59813, Dst Port: 25, Seq: 1, Len: 0

No.     Time           Source                Destination           Protocol Length Info
     23 0.114725217    192.168.50.100        192.168.50.101        IPv4     42     Fragmented IP protocol (proto=TCP 6, off=0, ID=31a2) [Reassembled in #25]

Frame 23: 42 bytes on wire (336 bits), 42 bytes captured (336 bits) on interface eth0, id 0
Ethernet II, Src: PCSSystemtec_ad:25:87 (08:00:27:ad:25:87), Dst: PCSSystemtec_5c:bf:f2 (08:00:27:5c:bf:f2)
Internet Protocol Version 4, Src: 192.168.50.100, Dst: 192.168.50.101
Data (8 bytes)

0000  e9 a5 1f 90 88 25 de 3e                           .....%.>

No.     Time           Source                Destination           Protocol Length Info
     24 0.114808886    192.168.50.100        192.168.50.101        IPv4     42     Fragmented IP protocol (proto=TCP 6, off=8, ID=31a2) [Reassembled in #25]

Frame 24: 42 bytes on wire (336 bits), 42 bytes captured (336 bits) on interface eth0, id 0
Ethernet II, Src: PCSSystemtec_ad:25:87 (08:00:27:ad:25:87), Dst: PCSSystemtec_5c:bf:f2 (08:00:27:5c:bf:f2)
Internet Protocol Version 4, Src: 192.168.50.100, Dst: 192.168.50.101
Data (8 bytes)

0000  00 00 00 00 60 02 04 00                           ....`...

No.     Time           Source                Destination           Protocol Length Info
     25 0.114895065    192.168.50.100        192.168.50.101        TCP      42     59813 → 8080 [SYN] Seq=0 Win=1024 Len=0 MSS=1460

Frame 25: 42 bytes on wire (336 bits), 42 bytes captured (336 bits) on interface eth0, id 0
Ethernet II, Src: PCSSystemtec_ad:25:87 (08:00:27:ad:25:87), Dst: PCSSystemtec_5c:bf:f2 (08:00:27:5c:bf:f2)
Internet Protocol Version 4, Src: 192.168.50.100, Dst: 192.168.50.101
Transmission Control Protocol, Src Port: 59813, Dst Port: 8080, Seq: 0, Len: 0

No.     Time           Source                Destination           Protocol Length Info
     26 0.115054348    192.168.50.100        192.168.50.101        IPv4     42     Fragmented IP protocol (proto=TCP 6, off=0, ID=1191) [Reassembled in #28]

Frame 26: 42 bytes on wire (336 bits), 42 bytes captured (336 bits) on interface eth0, id 0
Ethernet II, Src: PCSSystemtec_ad:25:87 (08:00:27:ad:25:87), Dst: PCSSystemtec_5c:bf:f2 (08:00:27:5c:bf:f2)
Internet Protocol Version 4, Src: 192.168.50.100, Dst: 192.168.50.101
Data (8 bytes)

0000  e9 a5 00 71 88 25 de 3e                           ...q.%.>

No.     Time           Source                Destination           Protocol Length Info
     27 0.115152784    192.168.50.100        192.168.50.101        IPv4     42     Fragmented IP protocol (proto=TCP 6, off=8, ID=1191) [Reassembled in #28]

Frame 27: 42 bytes on wire (336 bits), 42 bytes captured (336 bits) on interface eth0, id 0
Ethernet II, Src: PCSSystemtec_ad:25:87 (08:00:27:ad:25:87), Dst: PCSSystemtec_5c:bf:f2 (08:00:27:5c:bf:f2)
Internet Protocol Version 4, Src: 192.168.50.100, Dst: 192.168.50.101
Data (8 bytes)

0000  00 00 00 00 60 02 04 00                           ....`...

No.     Time           Source                Destination           Protocol Length Info
     28 0.115267404    192.168.50.100        192.168.50.101        TCP      42     59813 → 113 [SYN] Seq=0 Win=1024 Len=0 MSS=1460

Frame 28: 42 bytes on wire (336 bits), 42 bytes captured (336 bits) on interface eth0, id 0
Ethernet II, Src: PCSSystemtec_ad:25:87 (08:00:27:ad:25:87), Dst: PCSSystemtec_5c:bf:f2 (08:00:27:5c:bf:f2)
Internet Protocol Version 4, Src: 192.168.50.100, Dst: 192.168.50.101
Transmission Control Protocol, Src Port: 59813, Dst Port: 113, Seq: 0, Len: 0

No.     Time           Source                Destination           Protocol Length Info
     29 0.115550029    192.168.50.101        192.168.50.100        TCP      60     199 → 59813 [RST, ACK] Seq=1 Ack=1 Win=0 Len=0

Frame 29: 60 bytes on wire (480 bits), 60 bytes captured (480 bits) on interface eth0, id 0
Ethernet II, Src: PCSSystemtec_5c:bf:f2 (08:00:27:5c:bf:f2), Dst: PCSSystemtec_ad:25:87 (08:00:27:ad:25:87)
Internet Protocol Version 4, Src: 192.168.50.101, Dst: 192.168.50.100
Transmission Control Protocol, Src Port: 199, Dst Port: 59813, Seq: 1, Ack: 1, Len: 0

No.     Time           Source                Destination           Protocol Length Info
     30 0.121267268    192.168.50.101        192.168.50.100        TCP      60     8080 → 59813 [RST, ACK] Seq=1 Ack=1 Win=0 Len=0

Frame 30: 60 bytes on wire (480 bits), 60 bytes captured (480 bits) on interface eth0, id 0
Ethernet II, Src: PCSSystemtec_5c:bf:f2 (08:00:27:5c:bf:f2), Dst: PCSSystemtec_ad:25:87 (08:00:27:ad:25:87)
Internet Protocol Version 4, Src: 192.168.50.101, Dst: 192.168.50.100
Transmission Control Protocol, Src Port: 8080, Dst Port: 59813, Seq: 1, Ack: 1, Len: 0

No.     Time           Source                Destination           Protocol Length Info
     31 0.121267573    192.168.50.101        192.168.50.100        TCP      60     113 → 59813 [RST, ACK] Seq=1 Ack=1 Win=0 Len=0

Frame 31: 60 bytes on wire (480 bits), 60 bytes captured (480 bits) on interface eth0, id 0
Ethernet II, Src: PCSSystemtec_5c:bf:f2 (08:00:27:5c:bf:f2), Dst: PCSSystemtec_ad:25:87 (08:00:27:ad:25:87)
Internet Protocol Version 4, Src: 192.168.50.101, Dst: 192.168.50.100
Transmission Control Protocol, Src Port: 113, Dst Port: 59813, Seq: 1, Ack: 1, Len: 0

No.     Time           Source                Destination           Protocol Length Info
     32 0.124671414    192.168.50.100        192.168.50.101        IPv4     42     Fragmented IP protocol (proto=TCP 6, off=0, ID=bce4) [Reassembled in #34]

Frame 32: 42 bytes on wire (336 bits), 42 bytes captured (336 bits) on interface eth0, id 0
Ethernet II, Src: PCSSystemtec_ad:25:87 (08:00:27:ad:25:87), Dst: PCSSystemtec_5c:bf:f2 (08:00:27:5c:bf:f2)
Internet Protocol Version 4, Src: 192.168.50.100, Dst: 192.168.50.101
Data (8 bytes)

0000  e9 a5 0c ea 88 25 de 3e                           .....%.>

No.     Time           Source                Destination           Protocol Length Info
     33 0.127220959    192.168.50.100        192.168.50.101        IPv4     42     Fragmented IP protocol (proto=TCP 6, off=8, ID=bce4) [Reassembled in #34]

Frame 33: 42 bytes on wire (336 bits), 42 bytes captured (336 bits) on interface eth0, id 0
Ethernet II, Src: PCSSystemtec_ad:25:87 (08:00:27:ad:25:87), Dst: PCSSystemtec_5c:bf:f2 (08:00:27:5c:bf:f2)
Internet Protocol Version 4, Src: 192.168.50.100, Dst: 192.168.50.101
Data (8 bytes)

0000  00 00 00 00 60 02 04 00                           ....`...

No.     Time           Source                Destination           Protocol Length Info
     34 0.129236810    192.168.50.100        192.168.50.101        TCP      42     59813 → 3306 [SYN] Seq=0 Win=1024 Len=0 MSS=1460

Frame 34: 42 bytes on wire (336 bits), 42 bytes captured (336 bits) on interface eth0, id 0
Ethernet II, Src: PCSSystemtec_ad:25:87 (08:00:27:ad:25:87), Dst: PCSSystemtec_5c:bf:f2 (08:00:27:5c:bf:f2)
Internet Protocol Version 4, Src: 192.168.50.100, Dst: 192.168.50.101
Transmission Control Protocol, Src Port: 59813, Dst Port: 3306, Seq: 0, Len: 0

No.     Time           Source                Destination           Protocol Length Info
     35 0.129774231    192.168.50.100        192.168.50.101        IPv4     42     Fragmented IP protocol (proto=TCP 6, off=0, ID=e707) [Reassembled in #37]

Frame 35: 42 bytes on wire (336 bits), 42 bytes captured (336 bits) on interface eth0, id 0
Ethernet II, Src: PCSSystemtec_ad:25:87 (08:00:27:ad:25:87), Dst: PCSSystemtec_5c:bf:f2 (08:00:27:5c:bf:f2)
Internet Protocol Version 4, Src: 192.168.50.100, Dst: 192.168.50.101
Data (8 bytes)

0000  e9 a5 06 bb 88 25 de 3e                           .....%.>

No.     Time           Source                Destination           Protocol Length Info
     36 0.130310725    192.168.50.100        192.168.50.101        IPv4     42     Fragmented IP protocol (proto=TCP 6, off=8, ID=e707) [Reassembled in #37]

Frame 36: 42 bytes on wire (336 bits), 42 bytes captured (336 bits) on interface eth0, id 0
Ethernet II, Src: PCSSystemtec_ad:25:87 (08:00:27:ad:25:87), Dst: PCSSystemtec_5c:bf:f2 (08:00:27:5c:bf:f2)
Internet Protocol Version 4, Src: 192.168.50.100, Dst: 192.168.50.101
Data (8 bytes)

0000  00 00 00 00 60 02 04 00                           ....`...

No.     Time           Source                Destination           Protocol Length Info
     37 0.130889904    192.168.50.100        192.168.50.101        TCP      42     59813 → 1723 [SYN] Seq=0 Win=1024 Len=0 MSS=1460

Frame 37: 42 bytes on wire (336 bits), 42 bytes captured (336 bits) on interface eth0, id 0
Ethernet II, Src: PCSSystemtec_ad:25:87 (08:00:27:ad:25:87), Dst: PCSSystemtec_5c:bf:f2 (08:00:27:5c:bf:f2)
Internet Protocol Version 4, Src: 192.168.50.100, Dst: 192.168.50.101
Transmission Control Protocol, Src Port: 59813, Dst Port: 1723, Seq: 0, Len: 0

No.     Time           Source                Destination           Protocol Length Info
     38 0.131406112    192.168.50.100        192.168.50.101        IPv4     42     Fragmented IP protocol (proto=TCP 6, off=0, ID=ffb1) [Reassembled in #42]

Frame 38: 42 bytes on wire (336 bits), 42 bytes captured (336 bits) on interface eth0, id 0
Ethernet II, Src: PCSSystemtec_ad:25:87 (08:00:27:ad:25:87), Dst: PCSSystemtec_5c:bf:f2 (08:00:27:5c:bf:f2)
Internet Protocol Version 4, Src: 192.168.50.100, Dst: 192.168.50.101
Data (8 bytes)

0000  e9 a5 03 e3 88 25 de 3e                           .....%.>

No.     Time           Source                Destination           Protocol Length Info
     39 0.131564816    192.168.50.101        192.168.50.100        TCP      60     3306 → 59813 [SYN, ACK] Seq=0 Ack=1 Win=5840 Len=0 MSS=1460

Frame 39: 60 bytes on wire (480 bits), 60 bytes captured (480 bits) on interface eth0, id 0
Ethernet II, Src: PCSSystemtec_5c:bf:f2 (08:00:27:5c:bf:f2), Dst: PCSSystemtec_ad:25:87 (08:00:27:ad:25:87)
Internet Protocol Version 4, Src: 192.168.50.101, Dst: 192.168.50.100
Transmission Control Protocol, Src Port: 3306, Dst Port: 59813, Seq: 0, Ack: 1, Len: 0

No.     Time           Source                Destination           Protocol Length Info
     40 0.131490246    192.168.50.100        192.168.50.101        IPv4     42     Fragmented IP protocol (proto=TCP 6, off=8, ID=ffb1) [Reassembled in #42]

Frame 40: 42 bytes on wire (336 bits), 42 bytes captured (336 bits) on interface eth0, id 0
Ethernet II, Src: PCSSystemtec_ad:25:87 (08:00:27:ad:25:87), Dst: PCSSystemtec_5c:bf:f2 (08:00:27:5c:bf:f2)
Internet Protocol Version 4, Src: 192.168.50.100, Dst: 192.168.50.101
Data (8 bytes)

0000  00 00 00 00 60 02 04 00                           ....`...

No.     Time           Source                Destination           Protocol Length Info
     41 0.131544478    192.168.50.100        192.168.50.101        TCP      54     59813 → 3306 [RST] Seq=1 Win=0 Len=0

Frame 41: 54 bytes on wire (432 bits), 54 bytes captured (432 bits) on interface eth0, id 0
Ethernet II, Src: PCSSystemtec_ad:25:87 (08:00:27:ad:25:87), Dst: PCSSystemtec_5c:bf:f2 (08:00:27:5c:bf:f2)
Internet Protocol Version 4, Src: 192.168.50.100, Dst: 192.168.50.101
Transmission Control Protocol, Src Port: 59813, Dst Port: 3306, Seq: 1, Len: 0

No.     Time           Source                Destination           Protocol Length Info
     42 0.131721489    192.168.50.100        192.168.50.101        TCP      42     59813 → 995 [SYN] Seq=0 Win=1024 Len=0 MSS=1460

Frame 42: 42 bytes on wire (336 bits), 42 bytes captured (336 bits) on interface eth0, id 0
Ethernet II, Src: PCSSystemtec_ad:25:87 (08:00:27:ad:25:87), Dst: PCSSystemtec_5c:bf:f2 (08:00:27:5c:bf:f2)
Internet Protocol Version 4, Src: 192.168.50.100, Dst: 192.168.50.101
Transmission Control Protocol, Src Port: 59813, Dst Port: 995, Seq: 0, Len: 0

No.     Time           Source                Destination           Protocol Length Info
     43 0.132021573    192.168.50.101        192.168.50.100        TCP      60     1723 → 59813 [RST, ACK] Seq=1 Ack=1 Win=0 Len=0

Frame 43: 60 bytes on wire (480 bits), 60 bytes captured (480 bits) on interface eth0, id 0
Ethernet II, Src: PCSSystemtec_5c:bf:f2 (08:00:27:5c:bf:f2), Dst: PCSSystemtec_ad:25:87 (08:00:27:ad:25:87)
Internet Protocol Version 4, Src: 192.168.50.101, Dst: 192.168.50.100
Transmission Control Protocol, Src Port: 1723, Dst Port: 59813, Seq: 1, Ack: 1, Len: 0

No.     Time           Source                Destination           Protocol Length Info
     44 0.132468029    192.168.50.101        192.168.50.100        TCP      60     995 → 59813 [RST, ACK] Seq=1 Ack=1 Win=0 Len=0

Frame 44: 60 bytes on wire (480 bits), 60 bytes captured (480 bits) on interface eth0, id 0
Ethernet II, Src: PCSSystemtec_5c:bf:f2 (08:00:27:5c:bf:f2), Dst: PCSSystemtec_ad:25:87 (08:00:27:ad:25:87)
Internet Protocol Version 4, Src: 192.168.50.101, Dst: 192.168.50.100
Transmission Control Protocol, Src Port: 995, Dst Port: 59813, Seq: 1, Ack: 1, Len: 0

No.     Time           Source                Destination           Protocol Length Info
     45 0.132646707    192.168.50.100        192.168.50.101        IPv4     42     Fragmented IP protocol (proto=TCP 6, off=0, ID=e00a) [Reassembled in #47]

Frame 45: 42 bytes on wire (336 bits), 42 bytes captured (336 bits) on interface eth0, id 0
Ethernet II, Src: PCSSystemtec_ad:25:87 (08:00:27:ad:25:87), Dst: PCSSystemtec_5c:bf:f2 (08:00:27:5c:bf:f2)
Internet Protocol Version 4, Src: 192.168.50.100, Dst: 192.168.50.101
Data (8 bytes)

0000  e9 a5 00 8b 88 25 de 3e                           .....%.>

No.     Time           Source                Destination           Protocol Length Info
     46 0.132772730    192.168.50.100        192.168.50.101        IPv4     42     Fragmented IP protocol (proto=TCP 6, off=8, ID=e00a) [Reassembled in #47]

Frame 46: 42 bytes on wire (336 bits), 42 bytes captured (336 bits) on interface eth0, id 0
Ethernet II, Src: PCSSystemtec_ad:25:87 (08:00:27:ad:25:87), Dst: PCSSystemtec_5c:bf:f2 (08:00:27:5c:bf:f2)
Internet Protocol Version 4, Src: 192.168.50.100, Dst: 192.168.50.101
Data (8 bytes)

0000  00 00 00 00 60 02 04 00                           ....`...

No.     Time           Source                Destination           Protocol Length Info
     47 0.132854979    192.168.50.100        192.168.50.101        TCP      42     59813 → 139 [SYN] Seq=0 Win=1024 Len=0 MSS=1460

Frame 47: 42 bytes on wire (336 bits), 42 bytes captured (336 bits) on interface eth0, id 0
Ethernet II, Src: PCSSystemtec_ad:25:87 (08:00:27:ad:25:87), Dst: PCSSystemtec_5c:bf:f2 (08:00:27:5c:bf:f2)
Internet Protocol Version 4, Src: 192.168.50.100, Dst: 192.168.50.101
Transmission Control Protocol, Src Port: 59813, Dst Port: 139, Seq: 0, Len: 0

No.     Time           Source                Destination           Protocol Length Info
     48 0.132982339    192.168.50.100        192.168.50.101        IPv4     42     Fragmented IP protocol (proto=TCP 6, off=0, ID=e895) [Reassembled in #50]

Frame 48: 42 bytes on wire (336 bits), 42 bytes captured (336 bits) on interface eth0, id 0
Ethernet II, Src: PCSSystemtec_ad:25:87 (08:00:27:ad:25:87), Dst: PCSSystemtec_5c:bf:f2 (08:00:27:5c:bf:f2)
Internet Protocol Version 4, Src: 192.168.50.100, Dst: 192.168.50.101
Data (8 bytes)

0000  e9 a5 00 17 88 25 de 3e                           .....%.>

No.     Time           Source                Destination           Protocol Length Info
     49 0.133065677    192.168.50.100        192.168.50.101        IPv4     42     Fragmented IP protocol (proto=TCP 6, off=8, ID=e895) [Reassembled in #50]

Frame 49: 42 bytes on wire (336 bits), 42 bytes captured (336 bits) on interface eth0, id 0
Ethernet II, Src: PCSSystemtec_ad:25:87 (08:00:27:ad:25:87), Dst: PCSSystemtec_5c:bf:f2 (08:00:27:5c:bf:f2)
Internet Protocol Version 4, Src: 192.168.50.100, Dst: 192.168.50.101
Data (8 bytes)

0000  00 00 00 00 60 02 04 00                           ....`...

No.     Time           Source                Destination           Protocol Length Info
     50 0.133171732    192.168.50.100        192.168.50.101        TCP      42     59813 → 23 [SYN] Seq=0 Win=1024 Len=0 MSS=1460

Frame 50: 42 bytes on wire (336 bits), 42 bytes captured (336 bits) on interface eth0, id 0
Ethernet II, Src: PCSSystemtec_ad:25:87 (08:00:27:ad:25:87), Dst: PCSSystemtec_5c:bf:f2 (08:00:27:5c:bf:f2)
Internet Protocol Version 4, Src: 192.168.50.100, Dst: 192.168.50.101
Transmission Control Protocol, Src Port: 59813, Dst Port: 23, Seq: 0, Len: 0

No.     Time           Source                Destination           Protocol Length Info
     51 0.133234810    192.168.50.100        192.168.50.101        IPv4     42     Fragmented IP protocol (proto=TCP 6, off=0, ID=1828) [Reassembled in #55]

Frame 51: 42 bytes on wire (336 bits), 42 bytes captured (336 bits) on interface eth0, id 0
Ethernet II, Src: PCSSystemtec_ad:25:87 (08:00:27:ad:25:87), Dst: PCSSystemtec_5c:bf:f2 (08:00:27:5c:bf:f2)
Internet Protocol Version 4, Src: 192.168.50.100, Dst: 192.168.50.101
Data (8 bytes)

0000  e9 a5 00 6e 88 25 de 3e                           ...n.%.>

No.     Time           Source                Destination           Protocol Length Info
     52 0.133308302    192.168.50.100        192.168.50.101        IPv4     42     Fragmented IP protocol (proto=TCP 6, off=8, ID=1828) [Reassembled in #55]

Frame 52: 42 bytes on wire (336 bits), 42 bytes captured (336 bits) on interface eth0, id 0
Ethernet II, Src: PCSSystemtec_ad:25:87 (08:00:27:ad:25:87), Dst: PCSSystemtec_5c:bf:f2 (08:00:27:5c:bf:f2)
Internet Protocol Version 4, Src: 192.168.50.100, Dst: 192.168.50.101
Data (8 bytes)

0000  00 00 00 00 60 02 04 00                           ....`...

No.     Time           Source                Destination           Protocol Length Info
     53 0.133404755    192.168.50.101        192.168.50.100        TCP      60     139 → 59813 [SYN, ACK] Seq=0 Ack=1 Win=5840 Len=0 MSS=1460

Frame 53: 60 bytes on wire (480 bits), 60 bytes captured (480 bits) on interface eth0, id 0
Ethernet II, Src: PCSSystemtec_5c:bf:f2 (08:00:27:5c:bf:f2), Dst: PCSSystemtec_ad:25:87 (08:00:27:ad:25:87)
Internet Protocol Version 4, Src: 192.168.50.101, Dst: 192.168.50.100
Transmission Control Protocol, Src Port: 139, Dst Port: 59813, Seq: 0, Ack: 1, Len: 0

No.     Time           Source                Destination           Protocol Length Info
     54 0.133355867    192.168.50.100        192.168.50.101        TCP      54     59813 → 139 [RST] Seq=1 Win=0 Len=0

Frame 54: 54 bytes on wire (432 bits), 54 bytes captured (432 bits) on interface eth0, id 0
Ethernet II, Src: PCSSystemtec_ad:25:87 (08:00:27:ad:25:87), Dst: PCSSystemtec_5c:bf:f2 (08:00:27:5c:bf:f2)
Internet Protocol Version 4, Src: 192.168.50.100, Dst: 192.168.50.101
Transmission Control Protocol, Src Port: 59813, Dst Port: 139, Seq: 1, Len: 0

No.     Time           Source                Destination           Protocol Length Info
     55 0.133433362    192.168.50.100        192.168.50.101        TCP      42     59813 → 110 [SYN] Seq=0 Win=1024 Len=0 MSS=1460

Frame 55: 42 bytes on wire (336 bits), 42 bytes captured (336 bits) on interface eth0, id 0
Ethernet II, Src: PCSSystemtec_ad:25:87 (08:00:27:ad:25:87), Dst: PCSSystemtec_5c:bf:f2 (08:00:27:5c:bf:f2)
Internet Protocol Version 4, Src: 192.168.50.100, Dst: 192.168.50.101
Transmission Control Protocol, Src Port: 59813, Dst Port: 110, Seq: 0, Len: 0

No.     Time           Source                Destination           Protocol Length Info
     56 0.133496855    192.168.50.100        192.168.50.101        IPv4     42     Fragmented IP protocol (proto=TCP 6, off=0, ID=a1f4) [Reassembled in #60]

Frame 56: 42 bytes on wire (336 bits), 42 bytes captured (336 bits) on interface eth0, id 0
Ethernet II, Src: PCSSystemtec_ad:25:87 (08:00:27:ad:25:87), Dst: PCSSystemtec_5c:bf:f2 (08:00:27:5c:bf:f2)
Internet Protocol Version 4, Src: 192.168.50.100, Dst: 192.168.50.101
Data (8 bytes)

0000  e9 a5 06 b8 88 25 de 3e                           .....%.>

No.     Time           Source                Destination           Protocol Length Info
     57 0.133571607    192.168.50.100        192.168.50.101        IPv4     42     Fragmented IP protocol (proto=TCP 6, off=8, ID=a1f4) [Reassembled in #60]

Frame 57: 42 bytes on wire (336 bits), 42 bytes captured (336 bits) on interface eth0, id 0
Ethernet II, Src: PCSSystemtec_ad:25:87 (08:00:27:ad:25:87), Dst: PCSSystemtec_5c:bf:f2 (08:00:27:5c:bf:f2)
Internet Protocol Version 4, Src: 192.168.50.100, Dst: 192.168.50.101
Data (8 bytes)

0000  00 00 00 00 60 02 04 00                           ....`...

No.     Time           Source                Destination           Protocol Length Info
     58 0.133791089    192.168.50.101        192.168.50.100        TCP      60     23 → 59813 [SYN, ACK] Seq=0 Ack=1 Win=5840 Len=0 MSS=1460

Frame 58: 60 bytes on wire (480 bits), 60 bytes captured (480 bits) on interface eth0, id 0
Ethernet II, Src: PCSSystemtec_5c:bf:f2 (08:00:27:5c:bf:f2), Dst: PCSSystemtec_ad:25:87 (08:00:27:ad:25:87)
Internet Protocol Version 4, Src: 192.168.50.101, Dst: 192.168.50.100
Transmission Control Protocol, Src Port: 23, Dst Port: 59813, Seq: 0, Ack: 1, Len: 0

No.     Time           Source                Destination           Protocol Length Info
     59 0.133723328    192.168.50.100        192.168.50.101        TCP      54     59813 → 23 [RST] Seq=1 Win=0 Len=0

Frame 59: 54 bytes on wire (432 bits), 54 bytes captured (432 bits) on interface eth0, id 0
Ethernet II, Src: PCSSystemtec_ad:25:87 (08:00:27:ad:25:87), Dst: PCSSystemtec_5c:bf:f2 (08:00:27:5c:bf:f2)
Internet Protocol Version 4, Src: 192.168.50.100, Dst: 192.168.50.101
Transmission Control Protocol, Src Port: 59813, Dst Port: 23, Seq: 1, Len: 0

No.     Time           Source                Destination           Protocol Length Info
     60 0.133799496    192.168.50.100        192.168.50.101        TCP      42     59813 → 1720 [SYN] Seq=0 Win=1024 Len=0 MSS=1460

Frame 60: 42 bytes on wire (336 bits), 42 bytes captured (336 bits) on interface eth0, id 0
Ethernet II, Src: PCSSystemtec_ad:25:87 (08:00:27:ad:25:87), Dst: PCSSystemtec_5c:bf:f2 (08:00:27:5c:bf:f2)
Internet Protocol Version 4, Src: 192.168.50.100, Dst: 192.168.50.101
Transmission Control Protocol, Src Port: 59813, Dst Port: 1720, Seq: 0, Len: 0

No.     Time           Source                Destination           Protocol Length Info
     61 0.133863398    192.168.50.100        192.168.50.101        IPv4     42     Fragmented IP protocol (proto=TCP 6, off=0, ID=6562) [Reassembled in #64]

Frame 61: 42 bytes on wire (336 bits), 42 bytes captured (336 bits) on interface eth0, id 0
Ethernet II, Src: PCSSystemtec_ad:25:87 (08:00:27:ad:25:87), Dst: PCSSystemtec_5c:bf:f2 (08:00:27:5c:bf:f2)
Internet Protocol Version 4, Src: 192.168.50.100, Dst: 192.168.50.101
Data (8 bytes)

0000  e9 a5 00 6f 88 25 de 3e                           ...o.%.>

No.     Time           Source                Destination           Protocol Length Info
     62 0.133939661    192.168.50.100        192.168.50.101        IPv4     42     Fragmented IP protocol (proto=TCP 6, off=8, ID=6562) [Reassembled in #64]

Frame 62: 42 bytes on wire (336 bits), 42 bytes captured (336 bits) on interface eth0, id 0
Ethernet II, Src: PCSSystemtec_ad:25:87 (08:00:27:ad:25:87), Dst: PCSSystemtec_5c:bf:f2 (08:00:27:5c:bf:f2)
Internet Protocol Version 4, Src: 192.168.50.100, Dst: 192.168.50.101
Data (8 bytes)

0000  00 00 00 00 60 02 04 00                           ....`...

No.     Time           Source                Destination           Protocol Length Info
     63 0.134097509    192.168.50.101        192.168.50.100        TCP      60     110 → 59813 [RST, ACK] Seq=1 Ack=1 Win=0 Len=0

Frame 63: 60 bytes on wire (480 bits), 60 bytes captured (480 bits) on interface eth0, id 0
Ethernet II, Src: PCSSystemtec_5c:bf:f2 (08:00:27:5c:bf:f2), Dst: PCSSystemtec_ad:25:87 (08:00:27:ad:25:87)
Internet Protocol Version 4, Src: 192.168.50.101, Dst: 192.168.50.100
Transmission Control Protocol, Src Port: 110, Dst Port: 59813, Seq: 1, Ack: 1, Len: 0

No.     Time           Source                Destination           Protocol Length Info
     64 0.134192159    192.168.50.100        192.168.50.101        TCP      42     59813 → 111 [SYN] Seq=0 Win=1024 Len=0 MSS=1460

Frame 64: 42 bytes on wire (336 bits), 42 bytes captured (336 bits) on interface eth0, id 0
Ethernet II, Src: PCSSystemtec_ad:25:87 (08:00:27:ad:25:87), Dst: PCSSystemtec_5c:bf:f2 (08:00:27:5c:bf:f2)
Internet Protocol Version 4, Src: 192.168.50.100, Dst: 192.168.50.101
Transmission Control Protocol, Src Port: 59813, Dst Port: 111, Seq: 0, Len: 0

No.     Time           Source                Destination           Protocol Length Info
     65 0.134326059    192.168.50.100        192.168.50.101        IPv4     42     Fragmented IP protocol (proto=TCP 6, off=0, ID=e27b) [Reassembled in #68]

Frame 65: 42 bytes on wire (336 bits), 42 bytes captured (336 bits) on interface eth0, id 0
Ethernet II, Src: PCSSystemtec_ad:25:87 (08:00:27:ad:25:87), Dst: PCSSystemtec_5c:bf:f2 (08:00:27:5c:bf:f2)
Internet Protocol Version 4, Src: 192.168.50.100, Dst: 192.168.50.101
Data (8 bytes)

0000  e9 a5 00 15 88 25 de 3e                           .....%.>

No.     Time           Source                Destination           Protocol Length Info
     66 0.134426085    192.168.50.100        192.168.50.101        IPv4     42     Fragmented IP protocol (proto=TCP 6, off=8, ID=e27b) [Reassembled in #68]

Frame 66: 42 bytes on wire (336 bits), 42 bytes captured (336 bits) on interface eth0, id 0
Ethernet II, Src: PCSSystemtec_ad:25:87 (08:00:27:ad:25:87), Dst: PCSSystemtec_5c:bf:f2 (08:00:27:5c:bf:f2)
Internet Protocol Version 4, Src: 192.168.50.100, Dst: 192.168.50.101
Data (8 bytes)

0000  00 00 00 00 60 02 04 00                           ....`...

No.     Time           Source                Destination           Protocol Length Info
     67 0.134551751    192.168.50.101        192.168.50.100        TCP      60     1720 → 59813 [RST, ACK] Seq=1 Ack=1 Win=0 Len=0

Frame 67: 60 bytes on wire (480 bits), 60 bytes captured (480 bits) on interface eth0, id 0
Ethernet II, Src: PCSSystemtec_5c:bf:f2 (08:00:27:5c:bf:f2), Dst: PCSSystemtec_ad:25:87 (08:00:27:ad:25:87)
Internet Protocol Version 4, Src: 192.168.50.101, Dst: 192.168.50.100
Transmission Control Protocol, Src Port: 1720, Dst Port: 59813, Seq: 1, Ack: 1, Len: 0

No.     Time           Source                Destination           Protocol Length Info
     68 0.134583208    192.168.50.100        192.168.50.101        TCP      42     59813 → 21 [SYN] Seq=0 Win=1024 Len=0 MSS=1460

Frame 68: 42 bytes on wire (336 bits), 42 bytes captured (336 bits) on interface eth0, id 0
Ethernet II, Src: PCSSystemtec_ad:25:87 (08:00:27:ad:25:87), Dst: PCSSystemtec_5c:bf:f2 (08:00:27:5c:bf:f2)
Internet Protocol Version 4, Src: 192.168.50.100, Dst: 192.168.50.101
Transmission Control Protocol, Src Port: 59813, Dst Port: 21, Seq: 0, Len: 0

No.     Time           Source                Destination           Protocol Length Info
     69 0.134704825    192.168.50.100        192.168.50.101        IPv4     42     Fragmented IP protocol (proto=TCP 6, off=0, ID=517c) [Reassembled in #71]

Frame 69: 42 bytes on wire (336 bits), 42 bytes captured (336 bits) on interface eth0, id 0
Ethernet II, Src: PCSSystemtec_ad:25:87 (08:00:27:ad:25:87), Dst: PCSSystemtec_5c:bf:f2 (08:00:27:5c:bf:f2)
Internet Protocol Version 4, Src: 192.168.50.100, Dst: 192.168.50.101
